A2: Don't forget: Keep your eyes on your email's and the new web site Event Diary for more events during 2007

A1: Hampton-In-Arden Tennis Club Spring 2007 - MAXI-Tennis Update
A2: Well Done Captains! This weeks contests highlighted the power of the England squad against an ailing Scotland squad, the benefit to be gained by playing a 'purple nasty' with Italy seeing off France and a civilised, close exchange of tennis skills between two like-skilled and like minded teams (Ireland and Wales)! All the results (incl. and estimated score for the first Wales match) are up on the web site for everyone to see, even if they are not going to be involved in the tournament this time around. The next matches are on Sunday 25th February (a 3-week break this time around) and I am sure you all know who you are playing then (and at what time), but in case you don't: The current league positions are summarised below - England are DEFINITELY the team to beat! Once again, can you all make sure to send me the results sheet from your matches (via email if you are that organised or just throw it through the letterbox of 124 Old Station Road) Thanks ... and happy playing.

A1: Home Team | B1: Away Team | C1: Starting at
A2: Scotland | B2: Italy | C2: 13:15
A3: Ireland | B3: England | C3: 14:50
A4: Wales | B4: France | C4: 16:30

A2: Spring 2007: Maxi-Tennis League Table
A3: Team | B3: Played | C3: Lost | D3: Won | E3: Drawn | F3: League Points | G3: Total Tennis Games | H3: Total Tennis Points
A4: England | B4: 2 | C4: 0 | D4: 2 | E4: 0 | F4: =(D4*2)+E4 -> 4 | G4: =10+15 -> 25 | H4: =153+171 -> 324
A5: Italy | B5: 2 | C5: 1 | D5: 1 | E5: 0 | F5: =(D5*2)+E5 -> 2 | G5: =8+13 -> 21 | H5: =152+156 -> 308
A6: Wales | B6: 2 | C6: 1 | D6: 1 | E6: 0 | F6: =(D6*2)+E6 -> 2 | G6: =10+7 -> 17 | H6: =152+148 -> 300
A7: France | B7: 2 | C7: 1 | D7: 1 | E7: 0 | F7: =(D7*2)+E7 -> 2 | G7: =12+5 -> 17 | H7: =163+133 -> 296
A8: Ireland | B8: 2 | C8: 1 | D8: 1 | E8: 0 | F8: =(D8*2)+E8 -> 2 | G8: =6+11 -> 17 | H8: =126+149 -> 275
A9: Scotland | B9: 2 | C9: 2 | D9: 0 | E9: 0 | F9: =(D9*2)+E9 -> 0 | G9: =8+3 -> 11 | H9: =142+114 -> 256