A2: Don't forget: Keep your eyes on your email's and the new web site Event Diary for more events during 2007

A1: Hampton-In-Arden Tennis Club Spring 2007 - MAXI-Tennis Update
A2: Once again, well done Captains! Special thanks to Carol Grant for emailing the typed results - much appreciated! This weeks contests saw the England squad fall to their first defeat against a bubbling-under French side; Ireland winning against Scotland to go 4th (more later) and Italy once again triumphing (just about) against last years champions, Wales. This leaves the league table in quite an interesting position - with any upsets next week potentially causing a 5-way choice for finalists! To help with clarifying the position if that happens, this is how the order in the league table is decided: the first thing taken into consideration is the league points obtained by each team (2 for a win; 1 for a draw; 0 for a loss). In the event of a tie with league points, then the Total Tennis Games for each team are taken into consideration. If there is still a tie after these two, then the Total Tennis Points is called into play to help decide who is placed higher in the league. If all of those are tied .............. we'll get back to you! Just a reminder, all the results (incl. details of individual fixture and game scores) are up on the web site for everyone to see, even if they are not going to be involved in the tournament this time around. The final league matches are on Sunday 25th March (a 2-week break again) and I am sure you all know who you are playing then (and at what time), but in case you don't: The current league positions are summarised below - England are STILL the team to beat (but don't lose sight of Italy or Wales either! Away Captains (Ireland, Scotland and England): please make sure you prepare your match sheet from the spreadsheet (copy attached to this email or via the web site (click here to download your copy)) prior to the matches and complete all the results before sending me the results sheet from your matches (via email if you are that organised or just throw it through the letterbox of 124 Old Station Road). I will then get the results up on the web site as soon as possible. Thanks ... and happy playing.

A1: Home Team | B1: Away Team | C1: Starting at
A2: Italy | B2: Ireland | C2: 13:15
A3: France | B3: Scotland | C3: 14:50
A4: Wales | B4: England | C4: 16:30

A2: Spring 2007: Maxi-Tennis League Table
A3: Team | B3: Played | C3: Lost | D3: Won | E3: Drawn | F3: League Points | G3: Total Tennis Games | H3: Total Tennis Points
A4: England | B4: 4 | C4: 1 | D4: 3 | E4: 0 | F4: =(D4*2)+E4 -> 6 | G4: =10+15 -> 42 | H4: =153+171 -> 619
A5: Italy | B5: 4 | C5: 1 | D5: 3 | E5: 0 | F5: =(D5*2)+E5 -> 6 | G5: =8+13 -> 41 | H5: =152+156 -> 597
A6: Wales | B6: 4 | C6: 2 | D6: 2 | E6: 0 | F6: =(D6*2)+E6 -> 4 | G6: =10+7 -> 37 | H6: =152+148 -> 600
A7: Ireland | B7: 4 | C7: 2 | D7: 2 | E7: 0 | F7: =(D7*2)+E7 -> 4 | G7: =12+5 -> 36 | H7: =163+133 -> 576
A8: France | B8: 4 | C8: 2 | D8: 2 | E8: 0 | F8: =(D8*2)+E8 -> 4 | G8: =6+11 -> 35 | H8: =126+149 -> 588
A9: Scotland | B9: 4 | C9: 4 | D9: 0 | E9: 0 | F9: =(D9*2)+E9 -> 0 | G9: =8+3 -> 25 | H9: =142+114 -> 525